{"bindings":[{"agent_definition_digest":null,"agent_id":null,"allowed_tool_ids":[],"authorization_snapshot_ref":{"id":"fixture_45aff4eb16f2b2e77076bd5988871ebb3fc40cc2d40c3d14136da6fb632a5750","media_type":"application/json","sha256":"45aff4eb16f2b2e77076bd5988871ebb3fc40cc2d40c3d14136da6fb632a5750","size_bytes":35},"binding_id":"bind-proposal-1","context_policy":"sealed_packet","execution_mode":"runtime_reviewer","execution_target_ref":{"id":"fixture_5c421b88e180d364067a606be9b5da104168bb067f46ebfddb11f64c554a84a5","media_type":"application/json","sha256":"5c421b88e180d364067a606be9b5da104168bb067f46ebfddb11f64c554a84a5","size_bytes":45},"fallback_from":"no_capability_match","invocation_policy_digest":"dddddddddddddddddddddddddddddddddddddddddddddddddddddddddddddddd","model_identity":"fixture/model","ordinal":1,"provenance":"runtime_bound","provider_identity":"fixture-provider","revalidate_on_resume":true,"role":"proposal","role_instruction_ref":{"id":"fixture_9dc4e4c9cb31207f6370b6c60532e69fa31943cbba71252740c004be0f097812","media_type":"application/json","sha256":"9dc4e4c9cb31207f6370b6c60532e69fa31943cbba71252740c004be0f097812","size_bytes":34},"selection_reason":"runtime_fallback","tool_policy":"none"},{"agent_definition_digest":null,"agent_id":null,"allowed_tool_ids":[],"authorization_snapshot_ref":{"id":"fixture_45aff4eb16f2b2e77076bd5988871ebb3fc40cc2d40c3d14136da6fb632a5750","media_type":"application/json","sha256":"45aff4eb16f2b2e77076bd5988871ebb3fc40cc2d40c3d14136da6fb632a5750","size_bytes":35},"binding_id":"bind-judge-1","context_policy":"sealed_packet","execution_mode":"runtime_reviewer","execution_target_ref":{"id":"fixture_5c421b88e180d364067a606be9b5da104168bb067f46ebfddb11f64c554a84a5","media_type":"application/json","sha256":"5c421b88e180d364067a606be9b5da104168bb067f46ebfddb11f64c554a84a5","size_bytes":45},"fallback_from":"no_capability_match","invocation_policy_digest":"dddddddddddddddddddddddddddddddddddddddddddddddddddddddddddddddd","model_identity":"fixture/model","ordinal":1,"provenance":"runtime_bound","provider_identity":"fixture-provider","revalidate_on_resume":true,"role":"judge","role_instruction_ref":{"id":"fixture_a12603d55e39ee25b3feb5f1a403d9101d36c95dd216a10b974ef9e3b7a329b9","media_type":"application/json","sha256":"a12603d55e39ee25b3feb5f1a403d9101d36c95dd216a10b974ef9e3b7a329b9","size_bytes":31},"selection_reason":"runtime_fallback","tool_policy":"none"},{"agent_definition_digest":null,"agent_id":null,"allowed_tool_ids":[],"authorization_snapshot_ref":{"id":"fixture_45aff4eb16f2b2e77076bd5988871ebb3fc40cc2d40c3d14136da6fb632a5750","media_type":"application/json","sha256":"45aff4eb16f2b2e77076bd5988871ebb3fc40cc2d40c3d14136da6fb632a5750","size_bytes":35},"binding_id":"bind-judge-2","context_policy":"sealed_packet","execution_mode":"runtime_reviewer","execution_target_ref":{"id":"fixture_5c421b88e180d364067a606be9b5da104168bb067f46ebfddb11f64c554a84a5","media_type":"application/json","sha256":"5c421b88e180d364067a606be9b5da104168bb067f46ebfddb11f64c554a84a5","size_bytes":45},"fallback_from":"no_capability_match","invocation_policy_digest":"dddddddddddddddddddddddddddddddddddddddddddddddddddddddddddddddd","model_identity":"fixture/model","ordinal":2,"provenance":"runtime_bound","provider_identity":"fixture-provider","revalidate_on_resume":true,"role":"judge","role_instruction_ref":{"id":"fixture_a12603d55e39ee25b3feb5f1a403d9101d36c95dd216a10b974ef9e3b7a329b9","media_type":"application/json","sha256":"a12603d55e39ee25b3feb5f1a403d9101d36c95dd216a10b974ef9e3b7a329b9","size_bytes":31},"selection_reason":"runtime_fallback","tool_policy":"none"}],"diversity":{"distinct_agents":0,"distinct_models":1,"distinct_providers":1,"isolated_judgment_slots":2,"statistical_independence_proven":false,"unknown_agent_count":2,"unknown_model_count":0,"unknown_provider_count":0},"finalization":"deterministic_aggregate","generation":1,"kind":"decision_role_binding_plan","logical_run_id":"ldr_01010101010101010101010101010101","policy_bundle_digest":"856a78bcd82dc4c8e648eb8309ac773a9a7bb36527ba6c592da5acb4cc181753","resolver_version":"decision-role-resolver@v2","revision_binding_rule":"reuse_original_judge_binding","schema_version":1}